description,title,category
"Smaller stocks have continued to give higher returns to equity investors so far this fiscal, significantly outperforming bigger peers on indices.",Smaller stocks continue to give higher returns to investors so far this fiscal,business
"Since the start of this season, Red Bull and Mercedes have been at war, with both the title-contending teams finding ways to pull each other down the drain. Barcelona was the starter of this diabolical warfare. where Mercedes accused Red Bull of using flexi-wing technology. Well, the FIA intervened, reviewed the case, and ultimately released&#8230;The post Big Boost to Lewis Hamilton as Horner Offers Saudi Arabian GP Update on Mercedes&#8217; Controversial Suspension appeared first on EssentiallySports.",Big Boost to Lewis Hamilton as Horner Offers Saudi Arabian GP Update on Mercedes’ Controversial Suspension,sports
This jewel-bright image taken with the NASA/ESA Hubble Space Telescope features the spiral galaxy NGC 2903.,Image: Hubble gets galactic déjà vu,science
"Liam Livingstone hailed Jos Buttler as the best white-ball striker in international cricket currently, after the wicketkeeper batsman struck 32-ball 71* in England’s dominant eight-wicket win over Australia on Saturday. Livingstone himself played a crucial role, returning 1/15 from four overs.","T20 World Cup 2021 | Jos Buttler is the best white-ball hitter in the world, states Liam Livingstone",sports
"Former Italy international Gianluca Pagliuca said he was ‘surprised’ by Gianluigi Buffon’s move to Parma, but stressed the 43-year-old showed ‘courage’ to move to Serie B. ‘He’s still decisive’. The former Juventus star re-joined Parma, where it all started, this summer and former Inter star Pagliuca is impressed by the veteran. The 54-year-old is currently [&#8230;]","Pagliuca: ‘Buffon had the courage to go down to Serie B, he’s still decisive at 43’",sports
"The four crew members, three Americans and one German, were originally scheduled to launch on Sunday.",Weather Delays SpaceX Launch of Crew-3 Astronauts for NASA,science
"Researchers decipher when and why immune cells fail to respond to immunotherapy, suggesting that T cells need a different kind of prodding to re-engage the...The post Resistance to Cancer Therapy Determined by Differences in T Cells’ Functional State appeared first on SciTechDaily.",Resistance to Cancer Therapy Determined by Differences in T Cells’ Functional State,science
Behaviour Interactive fleshed out a creepy cast of characters by negotiating rights to everything from Saw to Silent Hill.,How Dead by Daylight  Became the Ultimate Game for Horror Fans,technology
A judge ruled Alta Fixsler's life support should be withdrawn in a hospice rather than at home.,Alta Fixsler: Toddler dies in hospice after parents' legal battle fails,health
We tested MagSafe compatibility on everything from cases to wireless chargers.,The Best iPhone 13 Cases and Accessories,technology
"ROME &#8212; A summit of the world&#8217;s 20 richest economies must agree to accelerate the phasing out of coal and invest more in renewable energy, Italian Prime Minister Mario Draghi told fellow G20 leaders on Sunday. &#8220;The decisions we take today will have a direct impact on the success of the (U.N.) Glasgow climate summit [&#8230;]",G20 nations need to accelerate phasing out of coal power -Draghi,business
Charles Schwab Investment Management Inc. Boosts Stock Position in Horizon Therapeutics Public Limited (NASDAQ:HZNP),Charles Schwab Investment Management Inc. Boosts Stock Position in Horizon Therapeutics Public Limited (NASDAQ:HZNP),general
"“It causes huge distress to tell a family, ‘We can’t serve you,’” said one state hospice organization director.","Short on Staff, Some Hospices Ask New Patients To Wait",health
"Charles Schwab Investment Management Inc. Increases Stake in Tetra Tech, Inc. (NASDAQ:TTEK)","Charles Schwab Investment Management Inc. Increases Stake in Tetra Tech, Inc. (NASDAQ:TTEK)",general
"Amundi Makes New $31.96 Million Investment in Paycom Software, Inc. (NYSE:PAYC)","Amundi Makes New $31.96 Million Investment in Paycom Software, Inc. (NYSE:PAYC)",general
"WWE veteran Dutch Mantell believes Vince McMahon will hold the vendetta against Charlotte. At the 2021 WWE Draft, Becky Lynch got drafted to Monday Night Raw whereas, Charlotte Flair got drafted to Friday Night SmackDown. In the last week&#8217;s Friday Night SmackDown, the segment between Becky Lynch and Charlotte Flair went heated. Both were head to&#8230;The post &#8220;There&#8217;s No Going Back&#8221; &#8211; WWE Legend Feels Vince McMahon Will Never Forgive Charlotte Flair appeared first on EssentiallySports.",“There’s No Going Back” – WWE Legend Feels Vince McMahon Will Never Forgive Charlotte Flair,sports
"The trackpad has to be removed to reveal two of the pull tabs | Image: iFixit Online tech repair guide and parts retailer iFixit has published its latest teardown for the new 2021 MacBook Pro and reveals at least one small win for reparability: the ability to replace the battery pack modules.The battery modules in the new MacBook Pros, much like many mobile devices, are now attached via adhesive strips with pull tabs. This makes it easier to remove them, as long as none of the tabs rip while pulling. The trackpad needs to also be carefully removed to reach the remaining pull tabs. Image: iFixit...",iFixit teardown of the 2021 MacBook Pro reveals easier battery swaps,technology
“It’s about leading the world or letting the world pass us by.”,What Does Social Spending Mean for American Power?,science
"Scientists discover the genetics inside legumes that control the production of an oxygen-carrying molecule, crucial to the plant’s close relationships with nitrogen-fixing bacteria. The finding...The post Genetics Discovery Reveals How Legumes Give Oxygen to Symbiotic Bacteria in Their Roots appeared first on SciTechDaily.",Genetics Discovery Reveals How Legumes Give Oxygen to Symbiotic Bacteria in Their Roots,science
"Lala Kent and Randall Emmett are officially over -- and this time, it looks like the break is gonna stick ... because the engagement has been called off on both sides. Sources familiar with the situation tell TMZ ... the 'Vaderpump Rules' stars are&hellip;",Randall Emmett & Lala Kent Officially Split,entertainment
Quantum physicists at the University of Copenhagen are reporting an international achievement for Denmark in the field of quantum technology. By simultaneously operating multiple spin...The post Innovative Chip Resolves Quantum Headache – Paves Road to Supercomputer of the Future appeared first on SciTechDaily.,Innovative Chip Resolves Quantum Headache – Paves Road to Supercomputer of the Future,science
"Technology for MSMEs: Recently India was ranked 71st out of 113 countries on the Global Food Security Index 2021 with respect to food quality and safety, affordability, availability, etc. ","Now food hawkers, vendors, other unorganised eateries can apply for FSSAI license through this new app",business
"“I don’t believe in fashion mistakes – I love to experiment with trends,” says Shannon Thomas.",‘I love a chunky shoe’: Inside a fashion boutique owner’s wardrobe,entertainment
"Here’s your hand-picked guide from our theatre reviewer on the don’t-miss shows to catch from now to the end of the year, and beyond.",From no business to show business: theatre is back in Melbourne,entertainment
"Don’t let the success of The Newsreader, Five Bedrooms, Rosehaven et al. fool you: the future for Australian drama and comedy has never been so uncertain.","It’s been a bumper year, but Australian TV drama is on a knife’s edge",entertainment
"The new money is welcomed by health leaders, but they warn it will not solve staff shortages.",Budget 2021: NHS in England to receive £5.9bn to cut waiting lists,health
"In A Bloody Good Rant, Thomas Keneally says the arts must again be nurtured, funded and valued as an extension of our country’s identity.",Arts ministers watched on as Australian film and television suffered,entertainment
"Intel is building dedicated gaming graphics cards, due out in Q1 2022, and we may have just gotten our first look at the big one, the Arc Alchemist. Here are some leaked images from YouTuber Moore’s Law is Dead (via Videocardz): Arc is Intel’s new GPU brand, designed to compete with Nvidia GeForce and AMD Radeon, and the Arc Alchemist is the first GPU in the company’s roadmap that’s actually scheduled to release. The company had previously built the Intel DG1 to test the GPU waters, but that was a comparatively weak card, based on the Xe LP (low-power) graphics architecture, and...",These might be the first leaked photos of Intel’s Arc Alchemist graphics card,technology
"Former Manchester United captain Gary Neville has disclosed that Cristiano Ronaldo preferred to play alongside Edinson Cavani in the attack.Neville stated this after Man United's 3-0 win over Tottenham in Saturday's Premier League game, with goals from Ronaldo, Cavani and Marcus Rashford.Neville reckons Portuguese superstar Cristiano Ronaldo thrived having Edinson Cavani alongside him.The Old Trafford legend said: ""There's no doubt this is not Ole's plan. Leaving Sancho, Rashford and Greenwood on the bench is not the plan.""That wasn't the plan in the recruitment, that wasn't the plan for Ole...",Ronaldo Prefers To Play Alongside Cavani -Neville,sports
Crystal Palace player Wilfried Zaha has called on Instagram to take racism more seriously after being targeted with abuse after scoring in a 2-0 win at Manchester City on SaturdayThe post Crystal Palace player Zaha critical of Instagram over racism appeared first on WTMJ.,Crystal Palace player Zaha critical of Instagram over racism,general
Experts strongly agree that the shots benefit the mother as well as the fetus.,Should Pregnant People Get a Covid Booster?,health
"TOKYO &#8212; Japanese Prime Minister Fumio Kishida&#8217;s ruling coalition was projected to maintain power in an election on Sunday, even as his party was forecast to take a drubbing, a blow that could return the world&#8217;s No.3 economy to political uncertainty. It was too close to call whether Kishida&#8217;s Liberal Democratic Party (LDP) would maintain [&#8230;]",Japan Kishida’s coalition to hang on to majority but his party weakened -exit polls,business
"Victorian Premier Daniel Andrews, who described Newton as an “icon, a larrikin and a born entertainer”, said details of the state funeral would be shared in coming days.",State funeral for ‘born entertainer’ Bert Newton to be held in Melbourne,entertainment
"Novavax, Inc. (NASDAQ:NVAX) Shares Sold by Charles Schwab Investment Management Inc.","Novavax, Inc. (NASDAQ:NVAX) Shares Sold by Charles Schwab Investment Management Inc.",general
"It might be counter-intuitive, but designing satellites to better fall apart is one of the key strategies to combat space debris. Developed by ESA’s&#160;Clean Space...The post Space Debris: Feel the Burn – Designing Satellites To Fall Apart appeared first on SciTechDaily.",Space Debris: Feel the Burn – Designing Satellites To Fall Apart,science
"A Swiss company is operating a device in Iceland that sucks CO2 from the air and shoots it into the ground, where it turns into rock.",Is Carbon Capture Here?,science
Amundi Invests $32.05 Million in Pan American Silver Corp. (NASDAQ:PAAS),Amundi Invests $32.05 Million in Pan American Silver Corp. (NASDAQ:PAAS),general
"Air passengers will soon be able to cut their carbon footprint when traveling on flights that are routed using satellites. An agreement signed today between...The post Making Air Travel Greener, With Some Help From Space appeared first on SciTechDaily.","Making Air Travel Greener, With Some Help From Space",science
"PUBG Mobile Pro Series Season 2 &#8211; Team Hidden PMGC 2021: The road to PUBG Mobile Global Championship 2021 is all upon us. Team Hidden from South Korea has qualified for the PMGC 2021 after winning PUBG Mobile Pro Series Season 2. However, The competition&#8217;s 2nd to 9th placed teams qualified for the PUBG Mobile [&#8230;]",PMGC 2021: Team Hidden Qualified after winning PUBG Mobile Pro Series Season 2,sports
A new RNA-based control switch could be used to trigger production of therapeutic proteins to treat cancer or other diseases. Researchers at MIT and Harvard...The post RNA Control Switch: Engineers Devise a Way To Selectively Turn On Gene Therapies in Human Cells appeared first on SciTechDaily.,RNA Control Switch: Engineers Devise a Way To Selectively Turn On Gene Therapies in Human Cells,science
"When online shopping, you&#8217;ve probably come across photos that spin around so you can see a product from all angles. This is typically done by taking a number of photos of a product from all angles, and then playing them like an animation. Luma &#8212; founded by engineers who left Apple&#8217;s AR and computer vision [&#8230;]",Luma raises $4.3M to make 3D models as easy as waving a phone around,technology
"How can rural producers in Rwanda better produce chicken for both household consumption and profit? University of Tennessee researchers are suggesting a hybrid model for the Rwandan broiler industry, among other improvements, in a new journal article.","A better way to raise chickens for low-intensity, small stakeholders",science
Elon Musk and Jeff Bezos Are Now Worth Almost Half a Trillion Dollars,Elon Musk and Jeff Bezos Are Now Worth Almost Half a Trillion Dollars,business
"Dhanteras or Dhanatrayodashi is the first day that marks the festival of Diwali. Worshippers of Goddess Lakshmi believe that investing in precious metals like gold on Dhanteras brings good luck, wealth, and prosperity",Dhanteras 2021: Gold coin vs jewellery vs biscuit - Which is the best option?,business
An intriguing candidate signal picked up last year by the Breakthrough Listen project has been subjected to intensive analysis that suggests it is unlikely to...The post Breakthrough Listen: Mysterious Signal “From” Proxima Centauri Probably Not Alien Civilization appeared first on SciTechDaily.,Breakthrough Listen: Mysterious Signal “From” Proxima Centauri Probably Not Alien Civilization,science
"PRAGUE &#8212; Volkswagen&#8217;s Skoda Auto will resume production on Sunday evening in most of its plants after a two-week outage caused by shortage of chips, CTK news agency reported. (Reporting by Robert Muller; Editing by Alison Williams)",Volkswagen’s Skoda to resume production after two-week outage – CTK news agency,business
"Photo Illustration by Thiago Prudêncio/SOPA Images/LightRocket via Getty Images Roblox has been down for more than a day, with the game and its related website offline for millions of players. The hugely popular game-creating platform first started having issues more than 30 hours ago, at 7PM ET on October 28th. Roblox said it was “working hard to get things back to normal,” and that it has identified “the root cause as [an] internal system issue.”It’s not clear exactly why Roblox is still down, but some players have been speculating the outage could be related to a Chipotle...",Roblox has been down for more than a day and it’s not because of Chipotle,technology
"For this Halloween, we have got some very special mix for you: the spookiest of outer space seen by NASA’s Hubble Space Telescope! So get your scary filters on and read ahead!",It’s Halloween Time! 5 spookiest images captured by NASA’s Hubble Space Telescope in outer space,business
"Buy now, pay later (BNPL) is an old form of payment that is new again in a big way. And that could mean trouble for BNPL fintechs that are just getting to know the world of lending.",Balancing risk: Modern architecture’s role in the BNPL playbook,technology
"Khamzat Chimaev proved that his rise to fame was not just a fluke after dominating Li Jingliang at UFC 267. &#8216;Borz&#8217; debuted in the UFC in 2020, and since then he&#8217;s been nothing but dominant. After winning his first three fights in the promotion spectacularly, he went up against a very game Li Jingliang. The&#8230;The post UFC Sensation Khamzat Chimaev Surpasses Kamaru Usman’s Instagram Followers After a Dominant Win at UFC 267 appeared first on EssentiallySports.",UFC Sensation Khamzat Chimaev Surpasses Kamaru Usman’s Instagram Followers After a Dominant Win at UFC 267,sports
An international team of scientists has created a powerful new resource to speed the development of vaccines and treatments to battle the next pandemic. University...The post Scientists Target Next Pandemic With Powerful New “Map” to Victory Over Viruses appeared first on SciTechDaily.,Scientists Target Next Pandemic With Powerful New “Map” to Victory Over Viruses,science
The annual trick-or-treating haul is a challenge for parents trying to balance holiday fun with healthy eating habits.,The Common Halloween Candy Mistakes That Parents Make,health
"Hello, and welcome to GhanaCelebrities.Com&#8217;s fan favourite photos of the day column. In these daily articles, we bring to you a collection of the most stylish celebrity photos spotted on the gram today. Instagram is where the celebrity life is lived so barely a day goes by without a good number of celebs giving us ... Read moreThe post PHOTOS of the Day &#8211; Nana Aba Anamoah, Tracey Boakye, Serwaa Amihere, Sandra Ababio appeared first on GhanaCelebrities.Com.","PHOTOS of the Day – Nana Aba Anamoah, Tracey Boakye, Serwaa Amihere, Sandra Ababio",entertainment
"T20 World Cup 2021, AFG vs NAM Predicted Playing 11, Squad: A look at the predictions, Playing XIs and squad list ahead of T20 WC AFG vs NAM","AFG vs NAM, T20 World Cup 2021 Playing XI, Dream11 Fantasy Team: Afghanistan 69/2 after 10 overs",sports
"Is your wardrobe a riot of clothes, most of which you don’t wear? Less really is more when it comes to elegant and effortless dressing.",12 wardrobe pieces every woman should own,entertainment
"It takes about 8500 years for a grain of sand from the Andes to be washed across the Argentine lowlands into the Río Paraná. The 1200-kilometer journey in the river called Río Bermejo is interrupted by many stops in river floodplains, where the grain is deposited, sometimes over thousands of years, and then washed free again. The sand is accompanied by organic carbon, washed in from soil and plants. The transport in water thus gains relevance for the climate: Rivers carry the carbon, which was previously removed from the atmosphere via photosynthesis, as sediment into the sea, where it is...",River beds that can shift naturally are more efficient carbon sinks than straightened rivers,science
"For some founders, tying themselves to impact is a way to play into trends and get noticed by investors, but there's a fine line between impact and pushing a narrative for marketing purposes.",3 signs that a startup’s ‘impact’ is just a marketing ploy for investors,technology
"The loss of seagrass habitat caused a dramatic shift in fish species in Morro Bay. Areas once covered with lush seagrass meadows and unique fish species are now home to muddy-seafloor-loving flatfish, according to a paper by Cal Poly researchers published in the October 2021 print edition of Estuaries and Coasts.",Morro Bay seagrass loss causes change in fish populations,science
Amundi Makes New $32.19 Million Investment in Vornado Realty Trust (NYSE:VNO),Amundi Makes New $32.19 Million Investment in Vornado Realty Trust (NYSE:VNO),general
Melbourne and Victoria’s regions reunited and major events to be held at Flemington Racecourse and Sidney Myer Music BowlVictorian Covid restrictions: what rules and regulations have changed?Vaccine rollout tracker; cases and data trackerBiden admits to Macron the US was ‘clumsy’ in Aukus submarine dealGet our free news app; get our morning email briefingThere have been 236 new locally acquired Covid cases reported in New South Wales today. Three people have also died with Covid. Continue reading...,Australia live Covid news update: NSW records 236 new cases and three deaths; crowds to test eased Melbourne restrictions,science
"Replacing petroleum-based aviation fuel with sustainable aviation fuel derived from a type of mustard plant can reduce carbon emissions by up to 68%, according to...The post Sustainable, Plant-Based Jet Fuel Could Reduce Emissions by 68% appeared first on SciTechDaily.","Sustainable, Plant-Based Jet Fuel Could Reduce Emissions by 68%",science
"Scott Carpenter Contributor Share on Twitter Scott Carpenter is Jigsaw’s Director of Policy and International Engagement. Prior to Google, Carpenter served as the Keston Family Fellow at the Washington Institute for Near East Policy and as the U.S. Deputy Assistant Secretary of State in the Bureau of Democracy and Human Rights. Authoritarian governments from twenty-one [&#8230;]",Internet shutdowns are a political weapon. It’s time to disarm.,technology
"A UCLA study “has implications for the public health system, health care providers and under-resourced communities that face the greatest burden from COVID-19,” said UCLA’s Arleen Brown.","For people of color in L.A., misinformation, past injustices contribute to vaccine hesitancy",health
JCB will take 10% of the green hydrogen made by Australian mining company Fortescue Future Industries.,JCB signs green hydrogen deal worth billions,business
Our Universe shines bright with light across the electromagnetic spectrum. While most of this light comes from stars like our Sun in galaxies like our...The post Exploring the Mysterious Origins of Extreme Cosmic Light Flashes That Outshine Entire Galaxies appeared first on SciTechDaily.,Exploring the Mysterious Origins of Extreme Cosmic Light Flashes That Outshine Entire Galaxies,science
Charles Schwab Investment Management Inc. Increases Stock Position in Newell Brands Inc. (NASDAQ:NWL),Charles Schwab Investment Management Inc. Increases Stock Position in Newell Brands Inc. (NASDAQ:NWL),general
"Africa Magic, the MultiChoice-owned entertainment channel, has premiered two brand new shows, ‘Movement Japa’ and ‘The Rishante’ which are set to air from Monday, November 1, 2021. Speaking at the exclusive premiere in Abuja the Executive Head, Content and West Africa Channels, MultiChoice Nigeria, Busola Tejumola, said the new series will take viewers on an [&#8230;]",Africa Magic excites viewers with premier of two new TV series,business
Keane accused his former club Manchester United of being unprofessional in last week’s match against the Reds,Roy Keane: Harry Maguire and Luke Shaw were a ‘disgrace’ in Liverpool hammering,sports
"If you have heart disease or risk factors for heart disease, you already know about the increased risk of heart attack and stroke. But did...The post Time for the Flu Shot? The Surprising Connection Between Influenza and Fatal Heart Attacks appeared first on SciTechDaily.",Time for the Flu Shot? The Surprising Connection Between Influenza and Fatal Heart Attacks,science
"“I don’t believe in fashion mistakes – I love to experiment with trends,” says Shannon Thomas.",‘I love a chunky shoe’: Inside a fashion boutique owner’s wardrobe,entertainment
"Designer Bianca Spender tells Jane Rocca how losing her mother has shifted her outlook on life, and why the pandemic has shaped her latest collection.",‘You only have one life’: Bianca Spender on life after losing her mother Carla Zampatti,entertainment
"Swiping into new ideas | Photo by Vjeran Pavic / The Verge Google’s Project Jacquard touch-sensitive fabric technology, first revealed at Google I/O in 2015, now has a way for interested third-party developers to integrate the tech with their own software via the new Jacquard SDK.Previously only a handful of companies signed up for Jacquard, including Levi’s, Samsonite, and Yves Saint Laurent. Now developers can use the SDK to integrate the Jacquard tag, connecting its sensors with their apps to communicate touch and motion data. Photo by Cameron Faulkner / The Verge Samsonite’s Konnect-i...",Developers can now try on Google’s Jacquard smart fabric tech,technology
The Kamilaroi artist has turned a childhood memory into a powerful new show.,Invisible no more: Artist Dennis Golding is the cape crusader,entertainment
Saudi Aramco Earnings Surge on Higher Oil Output and Prices,Saudi Aramco Earnings Surge on Higher Oil Output and Prices,business
"There&#8217;s nothing like the growing pains of new adulthood, but for college-aged gen Z-ers who have spent these formative years in lockdown, it can be even more difficult to form meaningful friendships. While attending Columbia University remotely during the pandemic, first-generation college student Jamie Lee realized how this isolation was affecting her peers, especially those [&#8230;]","Flox, an app to help friend groups meet each other, is wooing college students in NYC",technology
About 3.7 million people in England have had a booster dose of Covid vaccine.,Covid: When will I get a booster jab?,health
"Charles Schwab Investment Management Inc. Trims Stock Holdings in Novavax, Inc. (NASDAQ:NVAX)","Charles Schwab Investment Management Inc. Trims Stock Holdings in Novavax, Inc. (NASDAQ:NVAX)",general
Juventus head coach Massimiliano Allegri has hit out at his squad after a 2-1 defeat to Verona and admitted that the Old Lady are a mid-table team right now but can get out of their situation. The Serie A side have endured a tough start to their season with just four wins from their 11 league games.,"Juventus have to accept reality that right now we’re mid-table team, asserts Massimiliano Allegri",sports
