description,title,category
AFG vs NAM LIVE: Asghar Afghan receives guard of honour in final international game- Former Afghanistan captain Asghar Afghan has brought down curtains on his international career having announced that he will hang up his boots after the Namibia clash. The 33-year-old has enjoyed a stellar career for Afghanistan and was instrumental in their rise [&#8230;],"AFG vs NAM LIVE: Asghar Afghan receives guard of honour from Namibia, teammates in final international game ",sports
"Welcome to Startups Weekly, a fresh human-first take on this week’s startup news and trends. To get this in your inbox, subscribe here. I spent the past month interviewing current and former employees at Ro, a health tech unicorn, about rising tensions within the company as it struggles to grow into its $5 billion valuation. [&#8230;]",Every startup has a tipping point. How do you recalibrate?,technology
Webster Financial Co. (NYSE:WBS) Shares Acquired by Charles Schwab Investment Management Inc.,Webster Financial Co. (NYSE:WBS) Shares Acquired by Charles Schwab Investment Management Inc.,general
"Trying to attract investors and retain customers, the United Arab Emirates says it will step up its efforts to cut emissions.","U.A.E., an Oil Giant, Aims to Burnish Climate Credentials",science
"Garena Free Fire Max KillChori Challenge-Diwali Tshirt: Previously, Garena Free Fire has released a music video for this Diwali “Kill Chori” feat. Shraddha Kapoor & Bhuvan Bam. The song is now live. To engage more players, Garena has decided to launch KillChori Challenge. Max Gamers can get the official Free Fire Diwali T-shirt. So, Let&#8217;s [&#8230;]",Garena Free Fire Max KillChori Challenge: Lucky winners stand a chance to win the official Free Fire Diwali Tshirt!,sports
Charles Schwab Investment Management Inc. Trims Holdings in Cousins Properties Incorporated (NYSE:CUZ),Charles Schwab Investment Management Inc. Trims Holdings in Cousins Properties Incorporated (NYSE:CUZ),general
"Amundi Makes New $32.41 Million Investment in AMETEK, Inc. (NYSE:AME)","Amundi Makes New $32.41 Million Investment in AMETEK, Inc. (NYSE:AME)",general
"But the chancellor says the data does not suggest ""immediately"" moving to government's back-up plan.",Covid: Labour calls for Plan B measures in England,health
Amundi Buys New Holdings in Green Plains Inc. (NASDAQ:GPRE),Amundi Buys New Holdings in Green Plains Inc. (NASDAQ:GPRE),general
The rare discovery came about as a result of efforts to preserve the species.,"Endangered California Condors Can Reproduce Asexually, Study Finds",science
Michael Saylor Says He Has No Opinions About Shiba Inu Vs. Dogecoin,Michael Saylor Says He Has No Opinions About Shiba Inu Vs. Dogecoin,business
Pangea will take over PCR tests for departing passengers at Tel Aviv's Ben Gurion Airport from November 1.,"Covid testing at Ben Gurion changes hands, prices rise",business
"Luis Robert's $1 million lambo now officially matches his flashy game -- 'cause the MLB player just got the ride covered in a Naruto wrap ... and it's awesome!! TMZ Sports has learned ... the Chicago White Sox star is a huge anime fan, so he sought&hellip;",MLB's Luis Robert Tricks Out $1 Mil Lambo W/ Glow-In-The-Dark Naruto Wrap,entertainment
BOE Rate Hike Hinges on the Views of Two Quiet Deputy Governors,BOE Rate Hike Hinges on the Views of Two Quiet Deputy Governors,business
"Feeling overwhelmed at the prospect of socializing, some are going with a lie very few will argue with: Covid exposure.","Do I Have Plans This Saturday? I’ve, Uh, Been Exposed to Covid.",health
Pink ribbons can be a tough reminder for many breast cancer survivors. Here’s how to make it easier.,"For Some Breast Cancer Survivors, October Is the Cruelest Month",health
Charles Schwab Investment Management Inc. Trims Stake in Invesco Ltd. (NYSE:IVZ),Charles Schwab Investment Management Inc. Trims Stake in Invesco Ltd. (NYSE:IVZ),general
Trading in your gas-busting vehicle for one with lower emissions doesn’t always reduce pollution. That’s prompting global efforts to establish second-use standards.,Dirty Car Exports Threaten Climate Goals,science
"At least tens of thousands in the UK, it is estimated, are not receiving the help they need.",Why women may wait decades for an ADHD diagnosis,health
"A growing crop of professionals are guiding people with attention deficit disorder toward healthier behaviors, and self-acceptance.",These Coaches Want to Help People Manage A.D.H.D.,health
"Amazon disclosed Friday that it owns a 20% stake in Rivian, the electric automaker that filed for an IPO earlier this month. As of September 30, the e-commerce giant held equity investments, including preferred stock of Rivian that represented about 20% ownership interest, according to the filing. That holding had a &#8220;carrying value&#8221; of $3.8 [&#8230;]",Amazon reveals 20% stake in Rivian ahead of EV maker’s IPO,technology
Have you ever had a business idea and questioned if it had the potential to be the next big thing? It&#8217;s normal to doubt and ... Read More →,8 Ways to Know If You Have a Great Business Idea,business
"The Sun emitted a significant solar flare peaking at 11:35 a.m. EDT on October 28, 2021. NASA’s Solar Dynamics Observatory, which watches the Sun constantly,...The post Sun Releases a Powerful Burst of Radiation – An X1-Class Solar Flare appeared first on SciTechDaily.",Sun Releases a Powerful Burst of Radiation – An X1-Class Solar Flare,science
A start-up in Spain is one of several around the globe betting on that possibility.,Can Seeds Planted by Drones Spawn New Forests?,science
"""Foreign brokerages like Merril Lynch, UBS and Nomura have downgraded India due to excessive valuations. This might have prompted FPIs to sell on a sustained basis,"" said V K Vijayakumar, chief investment strategist at Geojit Financial Services","FPIs turn net sellers in Oct; pull out Rs 12,278 cr",business
"African e-commerce fulfilment startups backed by Y Combinator seem to be piquing investors’ interest this year for their niche e-commerce play. Summer batch graduate ShipBlu is the latest on that list and confirmed to TechCrunch that it has raised $2.4 million in seed funding. The company, founded by Ali Nasser, Ahmed ElKawass, Abdelrahman Hosny in [&#8230;]",ShipBlu bags $2.4M for its e-commerce and fulfilment service in Egypt,technology
"Ahead of the 2020 Eifel Grand Prix, Sir Jackie Stewart revealed he could never regard Lewis Hamilton among Formula 1&#8217;s greatest drivers. In addition, the former British driver also said that the Briton had an unfair advantage over his rivals because of the conquering Mercedes team. And after equaling Michael Schumacher&#8217;s record of 91 wins&#8230;The post Sir Jackie Stewart Delivers His Verdict on Lewis Hamilton-Max Verstappen F1 Battle appeared first on EssentiallySports.",Sir Jackie Stewart Delivers His Verdict on Lewis Hamilton-Max Verstappen F1 Battle,sports
"Amundi Purchases New Shares in Discovery, Inc. (NASDAQ:DISCK)","Amundi Purchases New Shares in Discovery, Inc. (NASDAQ:DISCK)",general
"Using the Advanced Photon Source, scientists have recreated the structure of ice formed at the center of planets like Neptune and Uranus. Everyone knows about...The post Scientists Find Strange Black “Superionic Ice” That Could Exist Deep Inside Other Planets appeared first on SciTechDaily.",Scientists Find Strange Black “Superionic Ice” That Could Exist Deep Inside Other Planets,science
"Brewer took to Instagram to share the video. “Things are getting a little weird around here since Halloween is almost here,” he wrote while posting the clip.",Halloween’s EPIC dare! Zookeeper extracts tarantula from mouth in spine-chilling video – Watch,business
"Roma coach Jose Mourinho prepares for his first clash with Stefano Pioli, but his relationship with Milan has been delicate since his time at Inter, losing only twice in seven meetings with the Rossoneri. The match at the Olimpico in Rome sees the Special One face the Diavolo for the eighth time so far, and [&#8230;]",Mourinho vs. Milan: always a derby,sports
"Although U.S. cigarette sales slightly increased for the first time in 20 years during the pandemic, total cigarette industry purchases fell 6.5% in the most recent quarter, compared with the same period last year, according to a recent report.","Pandemic uptick in cigarette sales is over, report suggests",health
The U.S. Securities and Exchange Commission must thoroughly investigate Facebook and enforce our laws.,Why Facebook’s angry emoji should interest the US SEC,technology
Amundi Makes New Investment in The J. M. Smucker Company (NYSE:SJM),Amundi Makes New Investment in The J. M. Smucker Company (NYSE:SJM),general
"Charles Schwab Investment Management Inc. Sells 78,145 Shares of Cousins Properties Incorporated (NYSE:CUZ)","Charles Schwab Investment Management Inc. Sells 78,145 Shares of Cousins Properties Incorporated (NYSE:CUZ)",general
"Welcome back to The TechCrunch Exchange, a weekly startups-and-markets newsletter for your weekend enjoyment.",How VCs are adapting to meet an increasingly global startup market,technology
"For those watching closely, his 80-minute video announcing Facebook’s rebrand delivered some self-referential jokes.",Mark Zuckerberg's Meta Presentation Was Full of Meme References,technology
Glover Teixeira became the second oldest champion in UFC history at UFC 267 when he tapped out Jan Blachowicz to secure the light-heavyweight title. The 42-year-old locked in the rear-naked choke on Blachowicz in the second round and managed to win his first-ever world title seven years after he last challenged for the same belt [&#8230;],Conor McGregor tweets in amazement as Glover Teixeira becomes oldest first-time UFC champion ever at 42,sports
What looks like two glowing eyes and a crooked carved smile in this new NASA/ESA Hubble Space Telescope snapshot is the early stages of a...The post Hubble Spots Massive Space “Pumpkin” appeared first on SciTechDaily.,Hubble Spots Massive Space “Pumpkin”,science
The decision means 28 million US children between the ages of five and 11 may soon be eligible for Covid jabs.,Covid vaccines: FDA approves Pfizer jabs for children 5 and up,health
PB Fintech IPO: All You Need To Know,PB Fintech IPO: All You Need To Know,business
"MANILA, Philippines—Shiga and Kiefer Ravena moved on to the next round of the Emperor’s Cup stopping B2 club Fukoka, 91-82, Sunday at Arena Tachikawa Tachihi in Tokyo. Ravena was on his playmaking self finishing with 12 points, two rebounds, nine assists, and one steal for the Lakestars. Sean Omara took care of the bulk of [&#8230;]The post Kiefer Ravena, Shiga advance in Emperor&#8217;s Cup appeared first on Inquirer Sports.","Kiefer Ravena, Shiga advance in Emperor’s Cup",sports
"29-year-old Amanda Shoultz chronicled her struggle with mysterious weight gain that was later diagnosed as a 17-pound tumor called a liposarcoma, according to a recent Good Morning America (GMA) report.",Woman's inexplicable weight gain leads to shocking cancer discovery,health
"Minneapolis voters to decide on scrapping police department, 18 months after George Floyd murder","Minneapolis voters to decide on scrapping police department, 18 months after George Floyd murder",business
"One of the most exciting aspects of next year&#8217;s Formula One season is the Miami Grand Prix. The excitement of F1 in the States has grown thanks to Netflix&#8217;s Drive to Survive. Additionally, what makes this Grand Prix even more exciting is that the pre-sale tickets were sold out soon after they went live. Seeing&#8230;The post Miami GP&#8217;s Recent Ticket Sale Figures are Out in Another Proof of F1&#8217;s Growing Popularity in the States appeared first on EssentiallySports.",Miami GP’s Recent Ticket Sale Figures are Out in Another Proof of F1’s Growing Popularity in the States,sports
"Bullish on demand for residential and commercial properties, Realty major DLF Ltd has identified a robust pipeline of new projects and will launch 35 million square feet area in medium term with a sales potential of around Rs 40,000 crore","DLF to launch 35 mn sq/ft of new projects in medium term with sales potential of about Rs 40,000 cr",business
"Here’s your hand-picked guide from our theatre reviewer on the don’t-miss shows to catch from now to the end of the year, and beyond.",From no business to show business: theatre is back in Melbourne,entertainment
"A new study offers insights into how the United States reacted to Tsar Bomba, a planet shaker that made the deadly Hiroshima blast look tame.",Tsar Bomba Nuclear Test 60 Years Ago Didn't Make J.F.K. Flinch,science
A U.S. Food and Drug Administration (FDA) advisory committee on Friday endorsed an emergency authorization for the Johnson & Johnson COVID-19 vaccine booster when administered at least two months after the initial dose among people ages 18 years and older ,FDA panel endorses Johnson & Johnson COVID-19 vaccine booster with 2-month gap for ages 18 and up,health
"Among the four rocky planets in our solar system, you could say that Earth’s “magnetic” personality is the envy of her interplanetary neighbors. When solar...The post Earth&#8217;s Magnetosphere: Protecting Our Planet from Harmful Space Radiation appeared first on SciTechDaily.",Earth’s Magnetosphere: Protecting Our Planet from Harmful Space Radiation,science
"DUBAI &#8212; Yasir al-Rumayyan, governor of Saudi Arabia&#8217;s sovereign wealth fund PIF, did not attend an investment forum in Riyadh last week because he was in self-quarantine after testing positive for COVID-19, Saudi-owned Al Arabiya TV reported, citing sources. The Public Investment Fund (PIF) did not respond to a Reuters request for comment on the [&#8230;]","Saudi PIF chief missed investment summit due to positive COVID-19 test, says Arabiya",business
"“Fool me once, shame on…shame on you. Fool me – you can’t get fooled again.” Former US President George W Bush. It’s easy to laugh at someone who believes the Earth is flat. Dunking on pro-diseasers (AKA: antivaxxers) has become one of the internet’s favorite sports. And it’s pretty posh by social media standards to ridicule anyone who questions whether the climate-crisis is real. There’s always going to be a small, vocal contingency of people who simply cannot be convinced of a ground truth. Whether these people deserve ridicule is a question for our personal consciences, but...",Why flat-Earthers are a clear and present threat to an AI-powered society,technology
"The sites attacked and which had files stolen include the Atraf LGBT dating site, and the Kavim bus company and Pegasus Tours.","Iranian hackers down Israeli websites, demand $1m ransom",business
"There’s a new venture studio in the world that looks rather different from earlier venture studios from a structural standpoint. Unlike renowned outfits like Atomic or Science or Expa that create companies that then sell equity to VCs who expect that equity to rise in value, this new studio, SuperLayer, plans to spin up consumer [&#8230;]","A new venture studio, SuperLayer, aims to become a preeminent Web3 launching pad",technology
"Illustration by Alex Castro / The Verge Microsoft surpassed Apple’s market cap on Friday to become the world’s most valuable public company. The change follows Apple’s Thursday earnings, where the company posted strong results but revealed that it lost $6 billion to supply chain constraints. On Tuesday, Microsoft also shared positive earnings boosted by Office, Windows, and its cloud products.At Friday’s market close, Microsoft’s market cap was almost $2.49 trillion while Apple’s was about $2.46 trillion, according to CNBC. This isn’t the first time Microsoft has passed Apple; the...",Microsoft overtakes Apple to become the world’s most valuable company,technology
"Amundi Buys Shares of 514,260 Principal Financial Group, Inc. (NASDAQ:PFG)","Amundi Buys Shares of 514,260 Principal Financial Group, Inc. (NASDAQ:PFG)",general
A study in mice raises intriguing questions about the ways that hormones influence the brain and motivate the body to move.,Does Estrogen Impact Exercise? What Scientists Are Learning,health
"Don’t let the success of The Newsreader, Five Bedrooms, Rosehaven et al. fool you: the future for Australian drama and comedy has never been so uncertain.","It’s been a bumper year, but Australian TV drama is on a knife’s edge",entertainment
"The prevalence of auditory symptoms in Covid-19 patients is unknown, but infection of the inner ears may be responsible for hearing and balance problems. Many...The post New COVID-19 Danger Revealed: SARS-CoV-2 Virus Can Infect the Inner Ear appeared first on SciTechDaily.",New COVID-19 Danger Revealed: SARS-CoV-2 Virus Can Infect the Inner Ear,science
"Nikon’s Z9 pro mirrorless camera has no mechanical shutter, relying solely on an electronic shutter. | Image: Nikon Nikon recently announced its new flagship camera, the Z9. This camera represents Nikon’s first mirrorless camera fully geared towards professional photographers and hybrid shooters, with a huge spec list designed for use in the demanding fields of photojournalism, sports, nature, birding, and any other use-cases that call for a camera that shoots incredibly fast at high resolution. The $5,500 Z9 is also Nikon’s first camera to omit a traditional mechanical shutter, allowing...",The Nikon Z9’s new sensor could be the start of a big shift in photography,technology
"Her research focused on how to keep dough, bread, cookies and crackers tasting delicious even after weeks on a grocery store shelf.","Louise Slade, Scientist Who Studied the Molecules in Food, Dies at 74",entertainment
Brazilian and American scientists on Thursday tranquilized a wild-born female jaguar now living in a protected area in Sao Paulo state. They're hoping the 110-pound feline named Bianca could make history for the second time in two years.,Brazil scientists test frozen jaguar semen to help species,science
"Welcome back to This Week in Apps, the weekly TechCrunch series that recaps the latest in mobile OS news, mobile applications and the overall app economy. The app industry continues to grow, with a record 218 billion downloads and $143 billion in global consumer spend in 2020. Consumers last year also spent 3.5 trillion minutes using apps on Android devices alone. [&#8230;]","This Week in Apps: SharePlay arrives, Android Dev Summit wraps, Snap and TikTok go to Congress",technology
"Las nuevas recomendaciones sobre la aspirina, la salud del corazón y el cáncer de colon han dejado a muchas personas confundidas. Esto es lo que tienes que saber.",¿Debo dejar de tomar aspirina? Y más dudas sobre el nuevo consejo,health
"Designer Bianca Spender tells Jane Rocca how losing her mother has shifted her outlook on life, and why the pandemic has shaped her latest collection.",‘You only have one life’: Bianca Spender on life after losing her mother Carla Zampatti,entertainment
"Credit Suisse AG Sells 9,193,506 Shares of BlackLine, Inc. (NASDAQ:BL)","Credit Suisse AG Sells 9,193,506 Shares of BlackLine, Inc. (NASDAQ:BL)",general
"Image: Twitter Twitter is allowing all iOS users to Super Follow select creators. The feature, first released in September and only available in the US and Canada, allows users to monetize their Twitter account and create exclusive content through monthly subscriptions. Twitter first announced Super Follows in February and rolled it out to select creators in September. Within the first two weeks, subscribers had contributed around $6,000, according to SensorTower. It’s Super Following time –– everyone globally on iOS now has the option to Super Follow select creators.— Twitter Support...",All iOS users can now Super Follow on Twitter ,technology
"Eagle Square is currently agog as party leaders and delegates gather to elect new members of the National Working Committee (NWC) of the People&#8217;s Democratic Party (PDP) that will pilot the affairs of the party for the next four years. Uncertainty had trailed the convention as the suspended national chairman of the party, Uche Secondus [&#8230;]","Eagle Square agog as party leaders, delegates converge for PDP National Convention",business
"Advances make high-density, 5D optical storage practical for long-term data archiving. Researchers have developed a fast and energy-efficient laser-writing method for producing high-density nanostructures in...The post 5D Optical Storage: High-Speed Laser Writing Could Pack 500 Terabytes Into CD-Sized Glass Disc appeared first on SciTechDaily.",5D Optical Storage: High-Speed Laser Writing Could Pack 500 Terabytes Into CD-Sized Glass Disc,science
"Under the cloudy weather at Martinsville, temperatures and tempers got high. Crew chief of ThorSport Racing, Junior Joiner got in a heated exchange with Trip Bruce of Halmar Friesen Racing team. Late in the race, ThorSport driver Matt Crafter was spun by his &#8220;worthless teammate&#8221; Grant Enfinger, after drama with 16 laps to go. But&#8230;The post Close-Up Footage of Junior Joiner Hurling Obscenities at Fellow NASCAR Truck Series Crew Chief at Martinsville appeared first on EssentiallySports.",Close-Up Footage of Junior Joiner Hurling Obscenities at Fellow NASCAR Truck Series Crew Chief at Martinsville,sports
Amundi Makes New Investment in Gold Fields Limited (NYSE:GFI),Amundi Makes New Investment in Gold Fields Limited (NYSE:GFI),general
"The Australian wine industry is experiencing some challenging times, but there are still some surprising benefits for Aussie wine loversThistledown Summer Road Old Vine Grenache, Riverland, South Australia 2020 (£8.49, Waitrose) These are interesting times for Australian wine. And by “interesting” I’m thinking of the supposedly (actually apocryphally) Chinese curse, since Australian wine producers are currently reeling from a near-complete collapse of sales to China, a country that was, until this year, their most valuable export market. The cause is a trade dispute that has led to the...",Down Under wines on the way up | David Williams,entertainment
Macron and Johnson Agree to De-Escalate Brexit Spat on Fish,Macron and Johnson Agree to De-Escalate Brexit Spat on Fish,business
"Husband of Ghanaian actress cum television presenter Xandy Kamel, King Kaninja, has been exposed as a serial cheat. His own wife has exposed him for cheating on her during their marriage. Apparently before they got married, Kaninja was allegedly dating a certain lady. Xandy snatched Kaninja from this lady, then rubbed it in her face. ... Read moreThe post Tall List of Women Xandy Kamel&#8217;s Husband has Allegedly Slept with &#8211; Photos appeared first on GhanaCelebrities.Com.",Tall List of Women Xandy Kamel’s Husband has Allegedly Slept with – Photos,entertainment
Vietnam Seafood Firms in South of Country Hit by Virus Outbreak,Vietnam Seafood Firms in South of Country Hit by Virus Outbreak,business
"Directed by German Filmmaker-York-Fabian Raabe, ‘Borga’, a film that tells both the tragic and exciting story of a young Ghanaian who becomes a quintessential Germany-based ‘Borga’ is scheduled to be premiered in Accra this Christmas—with thrilling screen goodies. Starring the multiple award-winning actress-Christiane Paul, it is Eugene Boateng’s excellent play of ‘Kojo’ that drives the ... Read moreThe post ‘BORGA’ is Coming Home This Christmas appeared first on GhanaCelebrities.Com.",‘BORGA’ is Coming Home This Christmas,entertainment
If his new strategy works — a big if — it could help address several of Facebook’s biggest problems.,Why Did Facebook Become Meta?,technology
"The industry expects the trends in 2021 will be able to reach pre-covid level sales of 2019 on the back of gold price hovering at Rs 46,000-47,000 per 22 carat 10 grams gold nearly 5 per cent lower than 2020, and jump in number of weddings, a senior official of an industry body said",This Dhanteras jewellers expecting strong demand,business
"MANILA, Philippines — Creamline came away with a clean sweep of Beach Volleyball Republic on Tour’s Sta. Ana tournaments Sunday. Sisi Rondina and Bernadeth Pons, who played under Creamline 1, ruled the women’s division after their 21-13, 21-11 victory over Creamline 2’s Dij Rodriguez and Dzi Gervacio. Creamline 1’s Krung Arbasto and Jude Garcia won [&#8230;]The post BVR on Tour: Rondina-Pons tandem sweeps anew to win second leg appeared first on Inquirer Sports.",BVR on Tour: Rondina-Pons tandem sweeps anew to win second leg,sports
"Henry Schein, Inc. (NASDAQ:HSIC) Shares Acquired by Charles Schwab Investment Management Inc.","Henry Schein, Inc. (NASDAQ:HSIC) Shares Acquired by Charles Schwab Investment Management Inc.",general
"Amundi Acquires Shares of 1,221,039 Juniper Networks, Inc. (NYSE:JNPR)","Amundi Acquires Shares of 1,221,039 Juniper Networks, Inc. (NYSE:JNPR)",general
"As the prime minister flies to COP26 in Glasgow, ""Globes"" examines his climate crisis agenda.",Bennett aims to make Israel a climate-tech leader,business
The Kamilaroi artist has turned a childhood memory into a powerful new show.,Invisible no more: Artist Dennis Golding is the cape crusader,entertainment
"Former President Trump&#8217;s new social network might be in hot water before it even launches. Mastodon, a free social media framework, alleges that Truth Social is passing open source software off as its own and has given them 30 days to fix this. If it doesn&#8217;t fix things by the end of next month, things [&#8230;]",Mastodon issues 30-day ultimatum to Trump’s social network over misuse of its code,technology
