description,title,category
Fuel contamination forced the residents of Iqaluit to rely on bottled water—and now they're having a hard time getting rid of the plastic.,A Water Crisis Reveals You Can't Recycle in the Arctic,technology
"In the full 2020-21 fiscal, excise collections were Rs 3.89 lakh crore and in 2019-20, it was Rs 2.39 lakh crore, Controller General of Accounts (CGA) data showed.","Excise collection 79% more than pre-Covid levels, says Delhi govt",business
SpaceX has bumped its next astronaut flight for NASA until Wednesday because of rough wind and waves hundreds of miles away.,"SpaceX delays astronaut flight due to rough wind, waves",science
"Vaccine misinformation has been pervasive issue on Facebook for years, and it wasn&#39;t until earlier this year that the website finally introduced policies that would address the problem. Now, the social network has expanded those policies and its COVID-19 vaccination efforts to include kids shortly after the FDA authorized the emergency use of the Pfizer COVID-19 vaccine for children ages five to eleven.In the coming weeks, it will send in-feed English and Spanish reminders to users in the US that the COVID-19 vaccine is now available for kids. Those reminders will also include a link that&#...",Facebook expands fight against COVID-19 vaccine misinformation to include kids,technology
"Burnley’s assistant manager Ian Woan has lavished praise upon legendary English boss Brian Clough and revealed that the genius was finding pieces that others wouldn’t see. Woah also added that Clough, the former Nottingham Forest manager, never allowed them to do any extra training.","Brian Clough’s magic was putting a team of misfits together, admits Ian Woan",sports
"According to our data, consumers in India are more aware of water purifiers compared to the consumers in the US.","Air-to-water tech entering India: Indian consumers more aware of water purifiers, says Cody Soodeen, Kara Water",business
A world obsessed with women’s hyper-visibility can dispatch them so swiftly to invisibility.,The Cruel Paradox of Linda Evangelista’s Fate,health
"With talks of Formula One wanting a third American race, we take a look at three circuits which could host a third F1 race in America.",Three Circuits Which Could Host a Third F1 Race In America,sports
"Hilaria Baldwin shared her support for husband Alec after he spoke publicly for the first time following the fatal shooting of Halyna Hutchins on the set of ""Rust.""",Hilaria Baldwin supports husband Alec after he speaks publicly on deadly 'Rust' shooting,entertainment
"As the flu season approaches and coincides with millions of Americans newly eligible for the Pfizer-BioNTech COVID-19 vaccine booster, with expert backing for boosters developed by Moderna and J&J, many may wonder whether it’s safe to receive both a booster and a flu vaccine in one visit.",COVID-19 vaccine booster and flu shot: Is it safe to receive both on same day?,health
"For a long time now, Vasyl Lomachenko has remained assertive about battling Teofimo Lopez in a rematch to gain back his lost lightweight straps. The pair collided last year, wherein Lopez pulled off an upset by beating the Ukrainian boxer by a unanimous decision. With this, Lopez even became the unified lightweight champ, holding WBO,&#8230;The post Vasyl Lomachenko’s Quest for Revenge May End Sooner Than Expected appeared first on EssentiallySports.",Vasyl Lomachenko’s Quest for Revenge May End Sooner Than Expected,sports
New results from the MicroBooNE experiment at the U.S. Department of Energy’s Fermi National Accelerator Laboratory deal a blow to a theoretical particle known as...The post Mysterious Physics Still Unexplained: MicroBooNE Experiment Shows No Hint of Sterile Neutrino appeared first on SciTechDaily.,Mysterious Physics Still Unexplained: MicroBooNE Experiment Shows No Hint of Sterile Neutrino,science
"The Congress is struggling with its own quandary, its narrative for the polls is, yet again, focussed solely around criticism of the NDA government and Prime Minister Narendra Modi.",Elections 2022: Why the Opposition narrative fails to shift beyond BJP’s failures,business
"Nets vs Pacers, NBA 2021-22: Brooklyn Nets&#8217; Kevin Durant fined $25K for throwing the ball into stands against Pacers- 11x All-Star and Brooklyn Nets forward Kevin Durant was penalized $25,000 by the league for &#8220;forcefully throwing the game ball into the spectator stands&#8221; during the third quarter of Friday&#8217;s Nets win over the Indiana Pacers. In the win [&#8230;]",NBA 2021-22: Brooklyn Nets’ Kevin Durant fined $25K for throwing the ball into stands against Pacers,sports
"Some fundamental differences, including over money, divide the leaders heading to Glasgow. The outcome will determine, to a large extent, how humanity will survive on a hotter planet.",The COP26 Climate Talks Are Opening. Here’s What to Expect.,science
"Apple may have given us a glimpse of what the new 14- and 16-inch MacBook Pros&#39; insides look like, but it had a surprise waiting for the folks at iFixit nonetheless. The iFixit team said removing batteries from recent MacBook Pros required ""infinite patience, a bottle of isopropyl alcohol, and an optional bottle of human-friendly alcohol."" They expected the same from this generation of laptops but were pleasantly surprised by the presence of pull tabs instead when they tore down the new MacBook Pros.The outer battery cells have noticeable pull tabs that you can, well, pull to detach them...",2021 MacBook Pro teardown reveals easy-to-remove batteries,technology
Different mechanisms suppressed the virus in each person. Research led by scientists at the National Institutes of Health has identified two distinct ways that people...The post Scientists Identify How Two People Controlled HIV After Stopping Antiretroviral Therapy Treatment appeared first on SciTechDaily.,Scientists Identify How Two People Controlled HIV After Stopping Antiretroviral Therapy Treatment,science
"Granted, there aren&#8217;t many cities where self-driving water taxis are a viable option, but Amsterdam may just be one of those places. This week, scientists from MIT’s Computer Science and Artificial Intelligence Laboratory (CSAIL) and the Senseable City Laboratory launched the first self-navigating, fully autonomous robot boats. They call &#8217;em Roboats (geddit?), and they made [&#8230;]",MIT’s CSAIL self-driving water taxis launched in the Amsterdam canals,technology
"Join us for all the build-up and action as it happens from today’s six Serie A games, including Inter-Udinese, Salernitana-Napoli and Roma-Milan. There have already been some surprises in Week 11 on Saturday, as Atalanta held Lazio to a 2-2 draw and Juventus lost 2-1 away to Verona before Torino flattened Sampdoria 3-0. We kick [&#8230;]",Liveblog: Serie A Wk11 Spooky Halloween Sunday 2021-22,sports
"NBA Champions Milwaukee Bucks to celebrate NBA title at White House on 8th of November- It has been a tradition for the NBA champions to visit the White House and celebrate their title with the President of the USA. However, this tradition was stopped when Donald Trump was the President. The last NBA champions to visit [&#8230;]",NBA Champions Milwaukee Bucks to celebrate NBA title at White House on 8th of November,sports
Scientific Questions Arrive in Ports Satellite observations of nitrogen dioxide near key U.S. ports suggest that increased shipping activity and backlogs may be affecting air...The post Satellite Observations Near Key U.S. Ports Show Unusual Shipping Activity and Backlogs May Be Affecting Air Quality appeared first on SciTechDaily.,Satellite Observations Near Key U.S. Ports Show Unusual Shipping Activity and Backlogs May Be Affecting Air Quality,science
A bill could be required to establish an all-India judicial service to recruit officers for subordinate courts through an entrance test.,Centre likely to make fresh attempt to reach consensus with states for an all-India judicial service,business
Officials Reach Agreement on Climate in Statement: G-20 Update,Officials Reach Agreement on Climate in Statement: G-20 Update,business
"Indian Bank on Saturday said it has reported over Rs 266 crore worth of fraud to the Reserve Bank, relating to three NPA accounts.",Indian Bank reports frauds of over Rs 266 cr in three accounts to RBI,business
UK officials are keeping a close watch on a new descendent of the Delta variant of Covid.,"What are the Delta, Gamma, Beta and Alpha Covid variants?",health
New research on a vast fossil site in Patagonia shows that some of the earliest dinosaurs lived in herds and suggests that this behavior may...The post Early Dinosaurs Were Social and Lived in Herds – May Have Been Key to Their Success appeared first on SciTechDaily.,Early Dinosaurs Were Social and Lived in Herds – May Have Been Key to Their Success,science
"England's Care Quality Commission issues a warning, saying staff are ""exhausted and depleted"".",Social care: Staff shortages will leave many without help - report,health
"Arc, a startup that launched 10 months ago with ambitions to electrify everything on the water, starting with a limited-edition $300,000 boat, has captured the attention and capital of some of the entertainment industry&#8217;s biggest stars. The startup, which closed a seed round in February led by VC firm Andreessen Horowitz, has brought on several [&#8230;]","Will Smith, Kevin Durant and Sean ‘Diddy’ Combs invest in electric boat startup Arc",technology
"Many Dutch ships passed the West Australian coast while enroute to Southeast Asia in the 1600s—and the national heritage listed shipwreck, Batavia, has revealed through its timbers the history of the shipbuilding materials that enabled Dutch East India Company (VOC) to flourish against major European rivals for the first time.",WA shipwreck reveals secrets of 17th -century Dutch seafaring domination,science
G-20 Leaders See Steps Needed to Keep Warming to 1.5 Degrees C,G-20 Leaders See Steps Needed to Keep Warming to 1.5 Degrees C,business
"Amundi Takes Position in Vidler Water Resources, Inc. (NASDAQ:VWTR)","Amundi Takes Position in Vidler Water Resources, Inc. (NASDAQ:VWTR)",general
"Photo by Cameron Faulkner / The Verge Don’t you love standards? I do, for the most part, particularly when they’re fixing things, and the new VESA Embedded DisplayPort 1.5 (or eDP 1.5 for short) looks likely to do that in future fancy-screened laptops. It’s promising more power savings with adaptive-sync screens, OLED panels, and displays that come with their own embedded memory for the battery saving Panel Self-Refresh (PSR) feature.eDP is the standard for cables and ribbons that connect your high-res screen to the rest of your laptop or tablet, and technically it’s supported all those...",VESA’s new eDP 1.5 might give your next laptop slightly better battery life,technology
Charles Schwab Investment Management Inc. Boosts Holdings in Newell Brands Inc. (NASDAQ:NWL),Charles Schwab Investment Management Inc. Boosts Holdings in Newell Brands Inc. (NASDAQ:NWL),general
Your bot is an extension of your company and is likely to be the first interaction a customer will have on your website or app. Use this opportunity to showcase the qualities your customers want.,3 ways to humanize support automation,technology
(marketscreener.com) G20 LEADERS FINAL COMMUNIQUE: WE WILL PURSUE EFFORTS TO LIMIT GLOBAL WARMING TO 1.5°C ABOVE PRE-INDUSTRIAL LEVELS https://www.marketscreener.com/news/latest/G20-LEADERS-FINAL-COMMUNIQUE-WE-WILL-PURSUE-EFFORTS-TO-LIMIT-GLOBAL-WARMING-TO-1-5-C-ABOVE-PRE-IN--36850023/?utm_medium=RSS&utm_content=20211031,G20 LEADERS FINAL COMMUNIQUE: WE WILL PURSUE EFFORTS TO LIMIT GLOBAL WARMING TO 1.5°C ABOVE PRE-INDUSTRIAL LEVELS,general
"Whether you want to treat a special friend or yourself, this autumn’s new scents make for a wonderful present - choose from vegan and sustainable packaging to long-lasting classicsWe are fast approaching that time of the year when we should all be getting our proverbials in gear and begin gift-planning. Scent is an easy place to start. I know giving fragrances, while not as unimaginative as vouchers, can seem lazy, but the fragrances on this page all tap into something that goes beyond “Oh, that smells nice!” Chloé’s new iteration of their modern classic scent is now vegan – as are...",The best new fragrances | Funmi Fetto,entertainment
"Diede de Groot became the first player to complete the golden slam in wheelchair tennis after winning all four majors and the Paralympic gold medal, completing the feat by winning the US Open final on Sunday.",Diede de Groot becomes the first player to complete the golden slam in wheelchair tennis,sports
"After the recent rise in prices, petrol now costs Rs 109.69 per litre in Delhi while diesel is being sold for Rs 98.42 per litre in the national capital.",Petrol now costs 32.79% more than ATF in Delhi; check latest rates here,business
Thailand’s Big Reopening Set to Test Pandemic-Era Tourism,Thailand’s Big Reopening Set to Test Pandemic-Era Tourism,business
"The king Solomon amongst the bloggers in Ghana, Zionfelix, has landed in another hot soup after his alleged side chick in UK launched a smear attack on him last Friday. The lady who claims Zionfelix has made a big fool out of her first dropped their Whatsapp screenshots that captured the moment the blogger-cum-Youtuber was ... Read moreThe post Zionfelix&#8217;s First Baby Mama Minalyn Reacts To His Most Recent Cheating Saga appeared first on GhanaCelebrities.Com.",Zionfelix’s First Baby Mama Minalyn Reacts To His Most Recent Cheating Saga,entertainment
"Welcome back to This Week in Apps, the weekly TechCrunch series that recaps the latest in mobile OS news, mobile applications and the overall app economy. The app industry continues to grow, with a record 218 billion downloads and $143 billion in global consumer spend in 2020. Consumers last year also spent 3.5 trillion minutes using apps on Android devices alone. [&#8230;]","This Week in Apps: SharePlay arrives, Android Dev Summit wraps, Snap and TikTok go to Congress",technology
"Top U.S.-China Diplomats Agree to Keep Talking, Control Tensions","Top U.S.-China Diplomats Agree to Keep Talking, Control Tensions",business
Molecular biologists studied the DNA of ones that migrated from North America to Eurasia and back. An international research team determined that ancestors of modern...The post Ancient DNA Reveals How the Ancestors of Modern Horses Migrated appeared first on SciTechDaily.,Ancient DNA Reveals How the Ancestors of Modern Horses Migrated,science
China-Focused Biotech LianBio Raises $325 Million in U.S. IPO,China-Focused Biotech LianBio Raises $325 Million in U.S. IPO,business
"Our corner of the universe, the solar system, is nestled inside the Milky Way galaxy, home to more than 100 billion stars. The solar system...The post Mysteries Abound: NASA Studying the Edge of the Sun’s Magnetic Bubble appeared first on SciTechDaily.",Mysteries Abound: NASA Studying the Edge of the Sun’s Magnetic Bubble,science
"Graphic: James Bareham/Polygon A full month of streaming recommendations, from horror movies to Halloween specials and weird videos Continue reading&hellip;",What to watch this Halloween weekend,entertainment
Debt Recast Under Second Covid Window Jumps For Private Banks,Debt Recast Under Second Covid Window Jumps For Private Banks,business
"Replacing petroleum-based aviation fuel with sustainable aviation fuel derived from a type of mustard plant can reduce carbon emissions by up to 68%, according to...The post Sustainable, Plant-Based Jet Fuel Could Reduce Emissions by 68% appeared first on SciTechDaily.","Sustainable, Plant-Based Jet Fuel Could Reduce Emissions by 68%",science
"You&#39;ll have to wait a little bit longer to watch SpaceX&#39;s third crewed NASA mission. NASA has delayed the launch of Crew-3 from early on Halloween to 1:10AM Eastern on November 3rd. The agency pinned the setback on ""unfavorable"" weather. There probably won&#39;t be another delay, though, as officials are predicting an 80 percent chance of good weather for the new date. Live overage of the launch on NASA&#39;s channel will start November 2nd at 8:45PM.Crew-3 will bring NASA astronauts Raja Chari (the mission commander), Tom Marshburn and Kayla Barron to the International Space Station...",NASA delays SpaceX Crew-3 launch to November 3rd,technology
(marketscreener.com) Reference: UPP/CS/JK/2021-050 UPP/CS/JK/2021-050 :&#65226;&#65183;&#65198;&#65251; Date: 01/11/2021 ...https://www.marketscreener.com/quote/stock/UNION-PROPERTIES-PUBLIC-J-9059462/news/Clarification-from-the-company-36852493/?utm_medium=RSS&utm_content=20211101,Clarification from the company,general
"Sha’Carri Richardson is one of the ten fastest women in the world and the 21-YO is just getting started. The American sprinter competes in the 100 meters and the 200 meters with 10.72 seconds and 22 seconds being her best timings. On the other hand, Justin Gatlin, the American track and field star, has also&#8230;The post &#8220;We Still Make Mistakes&#8221; &#8211; Justin Gatlin Pleads Fans to Give Sha&#8217;Carri Richardson More Time appeared first on EssentiallySports.",“We Still Make Mistakes” – Justin Gatlin Pleads Fans to Give Sha’Carri Richardson More Time,sports
"New Orleans Saints linebacker Demario Davis trolled FOX Sports&#8217; Skip Bayless after he defeated the Tampa Bay Buccaneers on Sunday. The New Orleans Saints have gotten the better of the Tampa Bay Buccaneers in the regular-season once Tom Brady joined the team. FOX Sports&#8217; Skip Bayless was ever so confident that Buccaneers would emerge with [&#8230;]Saints’ Demario Davis trolls Skip Bayless after beating Tom Brady, Bucs - FanSided - FanSided - Sports News, Entertainment, Lifestyle & Technology - 300+ Sites","Saints’ Demario Davis trolls Skip Bayless after beating Tom Brady, Bucs",sports
"When Bruce Arians met Saints head coach Sean Peyton to shake hands after the game, the Bucs head coach immediately asked after Jameis Winston. Jameis Winston was having a resurgent season as the starter for the New Orleans Saints. Then in a cruel twist of fate, he suffered a serious-looking injury against his former team. [&#8230;]Bruce Arians’ first concern was Jameis Winston after Bucs loss to Saints - FanSided - FanSided - Sports News, Entertainment, Lifestyle & Technology - 300+ Sites",Bruce Arians’ first concern was Jameis Winston after Bucs loss to Saints,sports
"Researchers decipher when and why immune cells fail to respond to immunotherapy, suggesting that T cells need a different kind of prodding to re-engage the...The post Resistance to Cancer Therapy Determined by Differences in T Cells’ Functional State appeared first on SciTechDaily.",Resistance to Cancer Therapy Determined by Differences in T Cells’ Functional State,science
