description,title,category
Harbhajan Singh has said that the Indian team can create pressure on New Zealand with MS Dhoni-like tactics on Sunday in Dubai. Both the teams have lost their opening game against Pakistan and will be looking to open their account in the points table of the T20 World Cup as they play each other.,"IND vs NZ | Pressure on New Zealand will have to be created with MS Dhoni-like field setting, says Harbhajan Singh",sports
"In light of racist abuse he received following the game against Manchester City, Wilfried Zaha revealed that he has become used to the abuse because it comes with the job. The Ivorian, who scored against City, also revealed that he wants more done and wants the league to take the issue seriously.","Not here for all nonsense that is being done instead of fixing actual problem, asserts Wilfried Zaha",sports
"All Yung Bleu wanted was a baby monkey ... instead, he mistakenly ended up with a baby baboon -- which grows quite a bit bigger -- but he's crossing his fingers and trying to make it work. We got the ""You're Mines Still"" rapper at SIXTY LES Hotel&hellip;",Yung Bleu Wanted Baby Monkey But Mistakenly Got Baboon Instead,entertainment
"It's Halloween but these famous faces have no body to celebrate with! This year, be on the prowl for ghosts, ghouls, witches and skeleton stars that are taking to the streets! These bone-chilling celebrities -- such as Kris Jenner, Travis Barker&hellip;",Stars In Skeleton Costumes -- Bad To The Bone!,entertainment
Invesco Ltd. (NYSE:IVZ) Shares Sold by Charles Schwab Investment Management Inc.,Invesco Ltd. (NYSE:IVZ) Shares Sold by Charles Schwab Investment Management Inc.,general
"You&#39;ll have to wait a little bit longer to watch SpaceX&#39;s third crewed NASA mission. NASA has delayed the launch of Crew-3 from early on Halloween to 1:10AM Eastern on November 3rd. The agency pinned the setback on ""unfavorable"" weather. There probably won&#39;t be another delay, though, as officials are predicting an 80 percent chance of good weather for the new date. Live overage of the launch on NASA&#39;s channel will start November 2nd at 8:45PM.Crew-3 will bring NASA astronauts Raja Chari (the mission commander), Tom Marshburn and Kayla Barron to the International Space Station...",NASA delays SpaceX Crew-3 launch to November 3rd,technology
"The Women’s FA Cup has been one heck of a rollercoaster, from endless goals to inspirational starlets and now the tournament has reached the semi-final stage.  Holders Manchester City host Chelsea at The Academy Stadium while Brighton travel to Meadow Park to take on Arsenal &#8211; with both set to be blockbuster clashes. Gareth Taylor’s [&#8230;]",Arsenal’s goal machine Vivianne Miedema and Manchester City’s three time PFA Young Player of the Year winner Lauren Hemp among players set to take the Women’s FA Cup semi-finals by storm,sports
"NASA&#39;s Juno probe has provided a better, deeper look at Jupiter&#39;s atmosphere. Researchers have produced the first 3D view of Jupiter&#39;s atmospheric layers, illustrating how its turbulent clouds and storms work in greater detail than before. Most notably, it&#39;s clearer how cyclones and anticyclones behave. They&#39;re much taller than expected, with the Great Red Spot (an anticyclone) running 200 miles deep. They&#39;re either warmer or colder at the top depending on their spin, too.Juno helped fill out the data using a microwave radiometer that offered a peek below the clouds&#39...",Juno probe provides the first 3D view of Jupiter's atmosphere,technology
"Auto rental giant Hertz gave its strongest signal to the markets that it had resurrected from bankruptcy with this week&#8217;s news that it would purchase 100,000 Tesla vehicles for a reported $4.2 billion. Hertz made headlines again two days later, when it said that Uber committed to renting up to half of that order for [&#8230;]",Tesla’s deal with Hertz opens a new frontier for the EV maker,technology
"Amundi Purchases Shares of 243,622 Sempra Energy (NYSE:SRE)","Amundi Purchases Shares of 243,622 Sempra Energy (NYSE:SRE)",general
A fireworks show that has nothing to do with the Fourth of July and everything to do with the cosmos is poised to be visible across the northern United States and Europe just in time for Halloween.,To star gazers: Fireworks show called Northern Lights coming,science
"Most Medicare beneficiaries don’t compare plans during open enrollment season, and may be paying more, or accepting more restrictions, than they should.",Why Aren’t More People Comparison Shopping for Health Plans?,science
U.N. envoy to Sudan discusses mediation options with ousted PM after major protests,U.N. envoy to Sudan discusses mediation options with ousted PM after major protests,business
"A day after Facebook’s rebranding as Meta (and simultaneous and unceremonious dropping of the Oculus brand), the company announced that it is acquiring Within. The Los Angeles firm is the developer of Supernatural, a Beat Saber-style workout app, Supernatural has been one of the real success stories in virtual reality fitness, with movement-based high-impact cardio [&#8230;]","Meta (Facebook) is buying Within, creators of the ‘Supernatural’ VR fitness app",technology
"Advisers say early action could save later, tougher measures to stop the spread of coronavirus.","Covid: Prepare to trigger England's Plan B curbs, say scientists",health
"This Day That Year: Chetan Sharma etched his name in the record books, clinched the first ever World Cup hat trick vs New Zealand in 1987- This day, 34 years ago, India&#8217;s Chetan Sharma scripted history by becoming the first bowler to take a World Cup hat-trick. This was also the first instance of an [&#8230;]","This Day That Year: Chetan Sharma etched his name in the record books, clinched the first ever World Cup hat trick vs New Zealand in 1987",sports
"BEIJING &#8212; Shanghai Disneyland said on Sunday that it has temporarily suspended entry to cooperate with COVID-19 investigations linked to other Chinese provinces and cities. Guests currently in the park are required to undergo COVID-19 tests at the exit when they leave, Shanghai Disneyland said on its Chinese social media account. Entry to the nearby [&#8230;]",Shanghai Disneyland suspends entry to cooperate with China’s COVID probes,business
"The kidney, from a genetically-altered pig, appeared to function well, say the surgical team.",US surgeons test pig kidney transplant in a human,health
"His books on that Vietnam episode drew acclaim, and he was an Edgar Award-winning author of nonfiction books about crime in its many manifestations.","Richard Hammer, Who Illuminated the My Lai Massacre, Dies at 93",entertainment
"Veteran Indian shuttler Ajay Jayaram lost the final at the Belgian International tournament on Saturday, against Malaysia's Ng Tze Yong, 21-14, 21-14. Jayaram was the only Indian to make it this far in the meet, while the likes of Shubhankar Dey, Siril Verma and Harsheel Dani lost in first round.",Ajay Jayaram loses Belgian International 2021 final against Malaysia's Ng Tze Yong,sports
"Vaccinating 5- to 11-year-olds could be a big step toward returning to normal life in the U.S., but even parents who got the shot are worried about how it might affect their kids.","Covid Shots Are a Go for Children, but Parents Are Reluctant to Consent",health
Pink ribbons can be a tough reminder for many breast cancer survivors. Here’s how to make it easier.,"For Some Breast Cancer Survivors, October Is the Cruelest Month",health
"Retail wealth management firm Prudent Corporate Advisory Services is planning to launch its IPO in the second half of November that will see private equity firm TA Associates making partial exit, the company's top official said on Sunday",Prudent Corporate Advisory Services plans to float IPO in November - details here,business
"Fans often use the f-word when talking about wrestling, but there are circumstances where it is anything but fake. The performers in the ring are scripted, but they are still incredible athletes and, most of the time, bigger than normal human beings. On the odd occasion, a fan has tried their luck attacking a wrestler [&#8230;]",When Triple H beat up a WWE fan for attacking Stone Cold Steve Austin in the ring,sports
"The 83-year-old TV legend will be remembered as a sidekick, and a superstar.","The eccentrically, imperfectly brilliant Bert Newton",entertainment
Amundi Invests $34.37 Million in Cenovus Energy Inc. (NYSE:CVE),Amundi Invests $34.37 Million in Cenovus Energy Inc. (NYSE:CVE),general
"Photo by Matt Winkelmeyer/Getty Images for BAFTA LA Amy Hennig, a former creative director at Naughty Dog who currently leads Skydance New Media, will be working on a new Marvel video game. Skydance describes the game, which is its first, as a “narrative-driven, blockbuster action-adventure game, featuring a completely original story and take on the Marvel Universe” but hasn’t said which superheroes will be featured in the game. The studio also hasn’t shared a release date (or even a release timeframe) and hasn’t said which platforms the game will be available on.Despite how little we...",Uncharted creative director Amy Hennig is making a Marvel game,technology
Asghar Afghan scored 31 as Afghanistan set Namibia a target of 161 in a Super 12 contest in Abu Dhabi on Sunday.,T20 World Cup: Asghar Afghan scores 31 in his last innings for Afghanistan,sports
"Victorian Premier Daniel Andrews, who described Newton as an “icon, a larrikin and a born entertainer”, said details of the state funeral would be shared in coming days.",State funeral for ‘born entertainer’ Bert Newton to be held in Melbourne,entertainment
"Arriving in Europe with an unfinished economic and environmental spending plan, the president will confront new challenges, some self-inflicted, at two major summits.",Biden Declared 'America is Back' in June. The World Is About to Test Him.,science
"I became infatuated – with the culture, the people, the language, even the beautiful chaos. Italy was a part of me, and I knew one day I would live there.",Italy has become the greatest romance of my life,entertainment
"Lando Norris was known for his Twitch streams and online gaming shenanigans. Now, Norris spends his free time out on the golf field instead of in his gamer chair. Charlotte Sefton, the driver&#8217;s press correspondent and friend, took a dig at this personality change. Sefton slammed Norris&#8217; new hobby at the tee. &#8220;You went from&#8230;The post Lando Norris&#8217; PR Manager Charlotte Sefton Calls Him Out for His Golf Habit appeared first on EssentiallySports.",Lando Norris’ PR Manager Charlotte Sefton Calls Him Out for His Golf Habit,sports
"Is there oxygen on Mars? Yes, Mars has oxygen but not very much and definitely not enough to just go out and breathe on the...The post We Asked a NASA Technologist: Is There Oxygen on Mars? [Video] appeared first on SciTechDaily.",We Asked a NASA Technologist: Is There Oxygen on Mars? [Video],science
"Washington Irving’s classic tale about a headless horseman plays out an ancient landscape scarred by tectonic collisions and the relentless forces of erosion. In 1798,...The post Halloween on the Hudson: Sleepy Hollow, a Headless Horseman, and Tectonic Collisions appeared first on SciTechDaily.","Halloween on the Hudson: Sleepy Hollow, a Headless Horseman, and Tectonic Collisions",science
"The Udemy IPO might seem like good news. After all, the company sold more than $420 million worth of its stock while going public at a price that surpassed its final private-market price. And yet.",Quick observations on Udemy’s unicorn edtech IPO,technology
Charles Schwab Investment Management Inc. Boosts Stock Position in Webster Financial Co. (NYSE:WBS),Charles Schwab Investment Management Inc. Boosts Stock Position in Webster Financial Co. (NYSE:WBS),general
,Presidential bet vows to ease regulation of private corporations,business
"The company had posted a net profit of Rs 31.14 crore in July-September period a year ago, it said in a regulatory filing.",IFB Industries Q2 Results: Net profit fall 21% to Rs 25 crore,business
"Is Southeast Asia about to hit an inflection point for tech startups? Four hundred million people in the region already use the internet, but by year&#8217;s end, one estimate suggests that 80% of the population over the age of 15 in Indonesia, Malaysia, the Philippines, Singapore, Thailand and Vietnam will be digital consumers. &#8220;As per [&#8230;]","TechCrunch+ roundup: BNPL competition heats up, Bowery Farming TC-1, Silicon Valley dreams",technology
"The Department of Financial Services (DFS), under the finance ministry, ""vide its order dated October 29 advised broad guidelines to be adopted by all public sector banks (PSBs) on 'Staff Accountability",FinMin issues uniform norms for accountability to protect bonafide decision of bankers,business
Candid looks at the inner workings of influential tech companies shouldn’t be so rare.,"Facebook, Show Us the Mess",technology
"Jon Rahm is one of the biggest names in golf right now. The PGA Tour icon has been a fan favorite, impressing most with his game and technique. It goes without saying that the World No. 1 is the best at what he does for a reason. However, in a recent NLU Podcast appearance, Rahm&#8230;The post ‘I Just Watch Every Instructional Video’ – Jon Rahm Explains How He Improves His Golf Game appeared first on EssentiallySports.",‘I Just Watch Every Instructional Video’ – Jon Rahm Explains How He Improves His Golf Game,sports
"Naomi Osaka has pledged to donate her earnings from next week's Western & Southern Open to support earthquake relief efforts in Haiti, the Caribbean nation her father hails from.",Osaka to donate prize money to Haitian earthquake relief efforts,sports
"IND vs NZ LIVE: How to watch T20 World Cup 2021 India vs New Zealand LIVE Streaming in your country, India &#8211; India & New Zealand will lock horns today in Dubai in what seems like a virtual quarterfinal for the Super 12 Group 2. Both teams have lost their respective opening fixtures against Pakistan [&#8230;]","IND vs NZ LIVE: How to watch T20 World Cup 2021 India vs New Zealand LIVE Streaming in your country, India",sports
Comments,Rutter (YC S19) is hiring engineers to build the data layer for ecommerce,technology
"Illustrations by Alex Castro / The Verge Nintendo is closing its Redwood City, California and Toronto, Canada offices, the company confirmed in a statement to The Verge. Kotaku reported on the closure of the Redwood City offices earlier on Friday. Here is the company’s full statement on the decision:Nintendo of America headquarters are in Redmond, WA, and Vancouver, BC. We are moving more of our employees and operations into those headquarters and will be closing small satellite offices in Toronto, ON, and Redwood City, CA, over time. Devon Pritchard, Executive Vice President, Business...",Nintendo is officially closing its Redwood City and Toronto offices,technology
"Pristyn Care has successfully built a network spanning 800+ surgical centers and 400 experienced surgeons, with an aim to bridge the healthcare accessibility gap in India.","Pristyn Care quadruples its surgery count since January 2021 from 40,000 surgeries reported in August 2021",business
"I became infatuated – with the culture, the people, the language, even the beautiful chaos. Italy was a part of me, and I knew one day I would live there.",Italy has become the greatest romance of my life,entertainment
"Jay-Z was inducted as part of an eclectic 2021 Rock & Roll Hall of Fame class that included Foo Fighters, Carole King, Tina Turner, and The Go-Gos.","Jay-Z, Foo Fighters inducted into Rock & Roll Hall of Fame by Obama, Chappelle",entertainment
"COP26 begins in Glasgow, amid dire warnings for the future if urgent climate action is not taken.",COP26: 'Moment of truth' as world meets for climate summit,science
"The Hartford Financial Services Group, Inc. (NYSE:HIG) Shares Sold by Credit Suisse AG","The Hartford Financial Services Group, Inc. (NYSE:HIG) Shares Sold by Credit Suisse AG",general
"A youngster from Kashmir, Tajamul Islam, has made the country proud after she won a gold medal in the Under-14 category at the Kickboxing Championship in Cairo, Egypt. Back in 2016 too, Tajamul had won gold in the same competition, but as an eight-year-old in the Under-9 category.",Kashmir's Tajamul Islam wins gold in World Kickboxing Championship,sports
Amundi Invests $32.04 Million in Edison International (NYSE:EIX),Amundi Invests $32.04 Million in Edison International (NYSE:EIX),general
"A needle-free COVID-19 vaccination could be possible, with University of Queensland scientists successfully protecting mice from the virus by administering a US-developed vaccine candidate with...The post Needle-Free COVID-19 Vaccine Shows Promise – Protection via a Single Pain-Free “Click” appeared first on SciTechDaily.",Needle-Free COVID-19 Vaccine Shows Promise – Protection via a Single Pain-Free “Click”,science
"Researchers in the U.S. and Japan have demonstrated the first experimental cross-sectional medical image that doesn't require tomography, a mathematical process used to reconstruct images in CT and PET scans . The work, published Oct. 14 in Nature Photonics, could lead to cheaper, easier and more accurate medical imaging.","Detector advance could lead to cheaper, easier medical scans",science
"Xandy Kamel and her husband, Ghanaian sports presenter King Kaninja, are the trending topic for today, taking over from Serwaa Broni. Xandy went ballistic on Instagram Friday, alleging that her husband had left her and gotten back together with his ex-girlfriend. The aftermath of her allegations has released a torrent of allegations against King Kaninja. ... Read moreThe post Stop Asking Stupid Questions About my Ring &#8211; Xandy Kamel&#8217;s Husband Speaks over Allegations of Chasing Sidechicks appeared first on GhanaCelebrities.Com.",Stop Asking Stupid Questions About my Ring – Xandy Kamel’s Husband Speaks over Allegations of Chasing Sidechicks,entertainment
"The dazzling phenomenon could be visible on Saturday night or early Sunday morning, experts said, depending on the weather and local light pollution.",Will You Be Able to See the Northern Lights This Weekend?,science
"Brawls might be the most entertaining point of a football match. While this statement made more sense ten years ago, it still stands solid in principle. During the Monday Night Football clash between Seattle Seahawks and New Orleans Saints, DK Metcalf got into a heated altercation with Marshon Lattimore. DK Metcalf and Marshon Lattimore fined&#8230;The post DK Metcalf and Marshon Lattimore Fined Heavily By NFL For Mid-Match Brawl During Monday Night Football appeared first on EssentiallySports.",DK Metcalf and Marshon Lattimore Fined Heavily By NFL For Mid-Match Brawl During Monday Night Football,sports
Photo by Drew Angerer/Getty Images Rep. Alexandria Ocasio-Cortez (D-NY) called Facebook a “cancer to democracy” in a tweet on Thursday shortly after the company announced that it was changing its corporate name to Meta to better represent its focus on building the metaverse. “Meta as in “we are a cancer to democracy metastasizing into a global surveillance and propaganda machine for boosting authoritarian regimes and destroying civil society… for profit!” said Ocasio-Cortez on Thursday. Meta as in “we are a cancer to democracy metastasizing into a global surveillance and...,AOC calls Facebook a ‘cancer to democracy’ after Meta rebrand,technology
"Heart health is a key component to the prevention of Type 2 diabetes, according to researchers. ",Heart health key to Type 2 diabetes prevention: researchers,health
"Thanks to algorithms that learn about social media users' content preferences, Facebook timelines, Twitter feeds, suggested YouTube videos, and other news streams can look startlingly different from one person's online account to the next. Media and communication experts often wrestle with how to rein in the forces that further polarize people with different views, especially people who sit on opposite sides of the political aisle. When it comes to online content that contains disinformation—inaccurate messages or propaganda intended to deceive and influence readers—why are some people more...",Is it worth trying to sway the most staunch climate deniers?,science
"Fed interest rate decision, domestic macroeconomic data announcements and quarterly earnings will be the major sentiment drivers for the equity market in a holiday-shortened week ahead, analysts said.Investors will also take cues from the monthly auto sales numbers to be announced on Monday","Fed decision, macro data, earnings to play major role in market movement this week: Analysts",business
"Simone Inzaghi warns Udinese will be ‘anything but simple’ for Inter today, while the coach explains his squad rotation approach. It kicks off at 11.30 GMT, you can follow all the build-up and action as it happens on the LIVEBLOG. “I expect this to be anything but a simple match,” Inzaghi told Sky Sport Italia. [&#8230;]",Inzaghi explains Inter squad rotation with Udinese,sports
"Pot brownies and colorful gummies may look harmless and can be easy to hide, but it’s important for caregivers to help adolescents understand the risks.",How to Talk to Teens About Edibles,health
Comments,Meticulous (YC S21) Is Hiring Founding Engineer (London),technology
Comments,Release (YC W20) Is Hiring – Product Director – Remote,technology
Resolving Municipal Distress In India,Resolving Municipal Distress In India,business
"Tribune OnlineParallel congresses: Four chairmen emerge at PRP in Kano AS factional chairmen emerged from state congresses of the ruling party, All Progressive Congress (APC) and the major opposition party, the People Democratic Party  (PDP), a similar occurrence has also emerged in Peoples Redemption Party (PRP), with four chairmen at the various just concluded parallel party congresses of the party, held on Saturday, Kano State. [&#8230;]Parallel congresses: Four chairmen emerge at PRP in Kano Tribune Online",Parallel congresses: Four chairmen emerge at PRP in Kano ,general
Comments,"Developer's resume with fake buzzwords gets 90% replies, the actual one gets 0%",technology
"The Health Ministry's director of public health, Sharon Alroy-Preis, is facing the maximum level of threat, according to Israel Police",Top Israeli health official to receive security detail as anti-vaxxer threats intensify,science
"The toughest questions most entrepreneurs face will involve international expansion. Whether to, when to, where to and how to expand all involve a wealth of complex considerations.",When should your B2C startup enter a new market?,technology
"Jay-Z was inducted as part of an eclectic 2021 Rock & Roll Hall of Fame class that included Foo Fighters, Carole King, Tina Turner, and The Go-Gos.","Jay-Z, Foo Fighters inducted into Rock & Roll Hall of Fame by Obama, Chappelle",entertainment
"A once-rare flesh-eating sexually transmitted disease that causes “beefy red” ulcers is spreading across the UK, according to a report Friday.",‘Flesh-Eating’ STD that causes ‘Beefy Red’ sores is spreading in UK,health
"AFG vs NAM LIVE Score &#8211; T20 World Cup LIVE: Opting to bat, Afghanistan have posted a good total of 160/5 on the back of handy knocks from M Shahzad, H Zazai & former skipper Asghar Afghan. Asghar Afghan scored 31 off 23 deliveries in his final innings. Earlier, H Zazai and M Shahzad provided [&#8230;]","AFG vs NAM LIVE Score: 161 to win for Namibia as Afghanistan finishes off at 160/5, Asghar Afghan hits fine thirty in his last innings- Follow LIVE updates",sports
"For the first time, researchers have used human data to quantify the speed of different processes that lead to Alzheimer’s disease and found that it...The post Scientists Identify the Cause of Alzheimer’s Progression in the Brain – Very Different Than Previously Thought appeared first on SciTechDaily.",Scientists Identify the Cause of Alzheimer’s Progression in the Brain – Very Different Than Previously Thought,science
"Amundi Makes New Investment in BeiGene, Ltd. (NASDAQ:BGNE)","Amundi Makes New Investment in BeiGene, Ltd. (NASDAQ:BGNE)",general
"The longer you have high levels of “bad” LDL cholesterol, the greater your risk of a heart attack.",How Lifelong Cholesterol Levels Can Harm or Help Your Heart,health
Priyanka Gandhi slammed the Samajwadi Party and Bahujan Samaj Party for alleging that the Grand Old Party was working in collusion with the BJP in Uttar Pradesh. ,"‘I will die but never…’: Priyanka Gandhi’s sharp attack on SP and BSP, says Yogi govt exploiting minorities",business
,Daily virus tally could fall to 500 by mid-November,business
"Medical reversals about menopause hormones, knee surgery and vitamins over the years have left patients confused. But doctors say these pivots often are good medicine.",Why Does Medical Advice Often Change? Doctors Explain,health
"Pat and Mark James both survived breast cancer, and want to warn ""macho"" men they could get it too.",Breast cancer: 'Both my husband and I survived the disease',health
"Dorit Kemsley says she and her family have stepped up security at their home since the scary home invasion that nearly cost her life -- but that home may be in their rearview soon. We got the 'RHOBH' star Friday night with her husband, Paul, and&hellip;",'RHOBH' Star Dorit Kemsley Breaks Silence After Home Invasion,entertainment
SJS Enterprises IPO: All You Need To Know,SJS Enterprises IPO: All You Need To Know,business
"A selection of recent real estate deals in Israel including in Lod, Nahariya, Kiryat Motzkin, Beersheva and Arad.",Apartments sold and rented,business
